"A resolution reaffirming the partnership between the United States and the Dominican Republic and advancing opportunities to deepen diplomatic, economic, and security cooperation between the two nations.",2021-12-07T05:00:00+00:00,2021-12-07T05:00:00+00:00,Introduced in Senate
Civics Learning Act of 2021,2021-01-21T05:00:00+00:00,2021-01-21T05:00:00+00:00,Introduced in House
Climate Stewardship Act of 2021,2021-04-14T04:00:00+00:00,2021-06-08T04:00:00+00:00,"Referred to the Subcommittee on National Parks, Forests, and Public Lands."
Recognizing the duty of the Federal Government to create a Green New Deal.,2021-04-20T04:00:00+00:00,2021-10-19T04:00:00+00:00,"Referred to the Subcommittee on the Constitution, Civil Rights, and Civil Liberties."
WPA Act,2021-02-25T05:00:00+00:00,2021-02-25T05:00:00+00:00,Introduced in House
International Pandemic Preparedness and COVID–19 Response Act of 2021,2021-06-24T04:00:00+00:00,2021-07-30T04:00:00+00:00,Committee on Foreign Relations. Reported by Senator Menendez with an amendment in the nature of a substitute. Without written report.
"To prohibit the Department of Health and Human Services from using any Federal funds to create or maintain an office to address climate and health equity, or for any climate change program, project, or activity.",2021-09-24T04:00:00+00:00,2021-09-27T04:00:00+00:00,Referred to the Subcommittee on Health.
Break Free From Plastic Pollution Act of 2021,2021-03-25T04:00:00+00:00,2021-03-25T04:00:00+00:00,Introduced in Senate
Resilient Ports Act,2021-05-07T04:00:00+00:00,2021-05-10T04:00:00+00:00,Referred to the Subcommittee on Coast Guard and Maritime Transportation.
Native Plant Species Pilot Program Act of 2021,2021-03-03T05:00:00+00:00,2022-06-14T04:00:00+00:00,Subcommittee Hearings Held.
Clean Energy Future Through Innovation Act of 2021,2021-06-24T04:00:00+00:00,2021-06-29T04:00:00+00:00,Referred to the Subcommittee on Energy.
Asuncion Valdivia Heat Illness and Fatality Prevention Act of 2021,2021-04-12T04:00:00+00:00,2021-04-12T04:00:00+00:00,Introduced in Senate
Watershed Results Act,2021-09-22T04:00:00+00:00,2021-09-22T04:00:00+00:00,Introduced in Senate
Energy Innovation and Carbon Dividend Act of 2021,2021-04-01T04:00:00+00:00,2021-04-02T04:00:00+00:00,Referred to the Subcommittee on Energy.
"Adopting the Rules of the House of Representatives for the One Hundred Seventeenth Congress, and for other purposes.",2021-01-04T05:00:00+00:00,2021-01-04T21:51:37+00:00,Motion to reconsider laid on the table Agreed to without objection.
Encouraging the Architect of the Capitol to transition to the exclusive use of electricity derived from renewable energy sources to power the United States Capitol Complex by 2032.,2021-03-26T04:00:00+00:00,2021-03-29T04:00:00+00:00,Referred to the Subcommittee on Water Resources and Environment.
Climate Stewardship Act of 2021,2021-04-12T04:00:00+00:00,2021-04-12T04:00:00+00:00,Introduced in Senate
START Act,2021-09-03T04:00:00+00:00,2021-09-07T04:00:00+00:00,Referred to the Subcommittee on Highways and Transit.
"Build Local, Hire Local Act",2021-05-25T04:00:00+00:00,2021-05-25T04:00:00+00:00,Introduced in Senate
NO EXHAUST Act of 2021,2021-04-26T04:00:00+00:00,2021-04-27T04:00:00+00:00,Referred to the Subcommittee on Energy.
America's Clean Future Fund Act,2021-03-10T05:00:00+00:00,2021-03-10T05:00:00+00:00,Introduced in Senate
Expressing the sense of the House of Representatives that the United States Trade Representative should promptly resume negotiations to conclude the Environmental Goods Agreement.,2021-04-08T04:00:00+00:00,2021-04-08T04:00:00+00:00,Introduced in House
Intelligence Authorization Act for Fiscal Year 2022,2021-09-29T04:00:00+00:00,2021-10-28T04:00:00+00:00,Reported (Amended) by the Committee on Intelligence. H. Rept. 117-156.
Combating Sexual Harassment in Science Act,2021-04-20T04:00:00+00:00,2021-05-19T04:00:00+00:00,"Received in the Senate and Read twice and referred to the Committee on Commerce, Science, and Transportation."
LIFT America Act,2021-03-11T05:00:00+00:00,2022-01-20T05:00:00+00:00,Referred to the Subcommittee on Energy and Mineral Resources.
"Recognizing World Oceans Day and the necessity to protect, conserve, maintain, and rebuild our ocean and its resources.",2021-06-08T04:00:00+00:00,2021-06-09T04:00:00+00:00,"Referred to the Subcommittee on Water, Oceans, and Wildlife."
Department of Energy Science for the Future Act,2021-05-28T04:00:00+00:00,2021-07-12T04:00:00+00:00,Received in the Senate and Read twice and referred to the Committee on Energy and Natural Resources.
"Commemorating the 70th anniversary of the signing of the Security Treaty among Australia, New Zealand, and the United States of America.",2021-09-03T04:00:00+00:00,2021-10-12T04:00:00+00:00,"Referred to the Subcommittee on Asia, the Pacific, Central Asia and Nonproliferation."
California Land Protection Act,2021-01-25T05:00:00+00:00,2021-02-18T05:00:00+00:00,Referred to the Subcommittee on Energy and Mineral Resources.
Expressing the sense of the House of Representatives related to the Department of Defense's consideration of the Intergovernmental Panel on Climate Change report.,2021-09-17T04:00:00+00:00,2021-09-17T04:00:00+00:00,Introduced in House
Wildfire Emergency Act of 2021,2021-05-26T04:00:00+00:00,2021-05-26T04:00:00+00:00,Introduced in Senate
Guaranteeing Ukrainian Autonomy by Reinforcing its Defense (GUARD) Act of 2022,2022-01-10T05:00:00+00:00,2022-01-10T05:00:00+00:00,Introduced in House
Civilian Climate Corps Act of 2021,2021-03-25T04:00:00+00:00,2021-03-25T04:00:00+00:00,Introduced in Senate
Justice for Black Farmers Act of 2021,2021-02-08T05:00:00+00:00,2021-02-08T05:00:00+00:00,Introduced in Senate
Oversight of Independent Review Commission Recommendations Act,2021-12-09T05:00:00+00:00,2021-12-09T05:00:00+00:00,Introduced in House
Securing American Leadership in Science and Technology Act of 2021,2021-03-23T04:00:00+00:00,2021-03-23T04:00:00+00:00,Introduced in House
Clean Energy and Sustainability Accelerator Act,2021-02-04T05:00:00+00:00,2021-03-03T05:00:00+00:00,"Referred to the Subcommittee on Commodity Exchanges, Energy, and Credit."
Shovel-Ready Restoration Grants for Coastlines and Fisheries Act of 2021,2021-02-01T05:00:00+00:00,2021-06-22T04:00:00+00:00,Committee Hearings Held.
Aviation Noise and Emissions Mitigation Act,2021-11-18T05:00:00+00:00,2021-11-19T05:00:00+00:00,Referred to the Subcommittee on Environment and Climate Change.
A resolution recognizing the duty of the Federal Government to create a Green New Deal.,2021-04-20T04:00:00+00:00,2021-04-20T04:00:00+00:00,Introduced in Senate
Paris Climate Agreement Disclosure Act,2021-03-10T05:00:00+00:00,2021-03-10T05:00:00+00:00,Introduced in House
REVIVE the CCC Act,2021-07-21T04:00:00+00:00,2021-07-21T04:00:00+00:00,Introduced in Senate
To authorize new grants for research into riparian forest genetics and climate adaptation.,2021-08-31T04:00:00+00:00,2021-09-27T04:00:00+00:00,"Referred to the Subcommittee on Water, Oceans, and Wildlife."
To oppose the use of the National Emergencies Act to declare a national emergency relating to climate change.,2021-02-15T05:00:00+00:00,2021-02-16T05:00:00+00:00,"Referred to the Subcommittee on Economic Development, Public Buildings, and Emergency Management."
Climate Resilient Transportation Infrastructure Study Act,2021-02-03T05:00:00+00:00,2021-02-04T05:00:00+00:00,Referred to the Subcommittee on Highways and Transit.
Energy PRICE Act of 2021,2021-07-20T04:00:00+00:00,2021-07-21T04:00:00+00:00,Referred to the Subcommittee on Energy.
Keep It in the Ground Act of 2021,2021-04-14T04:00:00+00:00,2021-06-08T04:00:00+00:00,Referred to the Subcommittee on Energy and Mineral Resources.
GSIB Act of 2021,2021-06-16T04:00:00+00:00,2021-06-23T04:00:00+00:00,Committee Consideration and Mark-up Session Held.
Community Parks Revitalization Act,2021-01-04T05:00:00+00:00,2021-03-08T05:00:00+00:00,"Referred to the Subcommittee on National Parks, Forests, and Public Lands."
Sarah Collins Rudolph Civil Rights Compensation Act of 2021,2021-07-19T04:00:00+00:00,2021-07-19T04:00:00+00:00,Introduced in House
Incentivizing Value Capture for Greener Transportation Act,2021-03-26T04:00:00+00:00,2021-03-29T04:00:00+00:00,Referred to the Subcommittee on Highways and Transit.
Clean Commute for Kids Act of 2021,2021-04-21T04:00:00+00:00,2021-04-22T04:00:00+00:00,Referred to the Subcommittee on Energy.
Federal Home Loan Banks' Mission Implementation Act,2021-05-18T04:00:00+00:00,2021-05-18T04:00:00+00:00,Introduced in Senate
National Institute of Manufacturing Act,2021-04-12T04:00:00+00:00,2021-04-12T04:00:00+00:00,Introduced in Senate
State and Local Digital Service Act of 2021,2021-05-28T04:00:00+00:00,2021-05-28T04:00:00+00:00,Introduced in Senate
"Recognizing the significant impact and legacy of Cecil Corbin-Mark in the environmental justice community and further recognizing that climate change most severely impacts vulnerable and disadvantaged communities in the United States and around the world, and that it is the responsibility of the United States Government to work with its global partners to promote environmental justice and climate.",2021-06-04T04:00:00+00:00,2021-08-04T04:00:00+00:00,"Referred to the Subcommittee on Europe, Energy, the Environment and Cyber."
Honoring OCEANIA Act,2021-05-20T04:00:00+00:00,2021-11-09T05:00:00+00:00,Referred to the Subcommittee on Immigration and Citizenship.
Public School Green Rooftop Program,2021-03-11T05:00:00+00:00,2021-03-11T05:00:00+00:00,Introduced in House
PLACE Act,2021-01-21T05:00:00+00:00,2021-02-04T05:00:00+00:00,Referred to the Subcommittee on Highways and Transit.
Celebrating the 149th anniversary of Arbor Day.,2021-05-07T04:00:00+00:00,2021-05-07T04:00:00+00:00,Introduced in House
FAIR Transition and Competition Act,2021-07-19T04:00:00+00:00,2021-07-20T04:00:00+00:00,Referred to the Subcommittee on Environment and Climate Change.
Smart Cities and Communities Act of 2021,2021-05-20T04:00:00+00:00,2021-05-21T04:00:00+00:00,Referred to the Subcommittee on Communications and Technology.
Wastewater Infrastructure Modernization Act,2021-06-04T04:00:00+00:00,2021-06-07T04:00:00+00:00,Referred to the Subcommittee on Water Resources and Environment.
BIOCHAR Act of 2021,2021-04-15T04:00:00+00:00,2021-06-15T04:00:00+00:00,Referred to the Subcommittee on Conservation and Forestry.
SWOLE Act,2021-08-03T04:00:00+00:00,2021-08-03T04:00:00+00:00,Introduced in House
Electric Vehicles for Underserved Communities Act of 2021,2021-03-01T05:00:00+00:00,2021-03-01T05:00:00+00:00,Introduced in Senate
Climate Security Jobs Act,2021-09-17T04:00:00+00:00,2021-09-17T04:00:00+00:00,Introduced in House
City and State Diplomacy Act,2021-07-19T04:00:00+00:00,2021-07-29T04:00:00+00:00,Committee Consideration and Mark-up Session Held.
Recognizing the national debt as a threat to national security.,2021-05-20T04:00:00+00:00,2021-05-20T04:00:00+00:00,Introduced in House
30 x 30 Termination Act,2021-05-07T04:00:00+00:00,2021-07-01T04:00:00+00:00,Referred to the Subcommittee on Conservation and Forestry.
Legacy Roads and Trails Act,2021-04-22T04:00:00+00:00,2021-07-13T04:00:00+00:00,Subcommittee Hearings Held.
Climate Change Education Act,2021-04-01T04:00:00+00:00,2021-04-02T04:00:00+00:00,Referred to the Subcommittee on Environment and Climate Change.
Protecting Europe's Energy Security Implementation Act,2021-12-18T05:00:00+00:00,2022-01-13T05:00:00+00:00,Measure laid before Senate by unanimous consent. (consideration: CR S198-217)
Declaring racism a public health crisis.,2021-04-22T04:00:00+00:00,2021-10-19T04:00:00+00:00,"Referred to the Subcommittee on the Constitution, Civil Rights, and Civil Liberties."
Teachers and School LEADERS Act of 2021,2021-09-21T04:00:00+00:00,2021-09-21T04:00:00+00:00,Introduced in Senate
FEMA Climate Change Preparedness Act,2021-02-08T05:00:00+00:00,2021-02-08T05:00:00+00:00,Introduced in Senate
Supporting Affordable and Reliable Energy in Developing Countries Act of 2021,2021-11-04T04:00:00+00:00,2021-11-04T04:00:00+00:00,Introduced in House
Climate Emergency Act of 2021,2021-03-23T04:00:00+00:00,2021-03-23T04:00:00+00:00,Introduced in Senate
Saline Lake Ecosystems in the Great Basin States Program Act of 2021,2021-09-23T04:00:00+00:00,2021-11-17T05:00:00+00:00,"Subcommittee on Water, Oceans, and Wildlife Discharged."
Grid Security Research and Development Act,2021-08-06T04:00:00+00:00,2021-08-07T04:00:00+00:00,"Referred to the Subcommittee on Cybersecurity, Infrastructure Protection, and Innovation."
America's Red Rock Wilderness Act,2021-05-10T04:00:00+00:00,2021-05-10T04:00:00+00:00,Introduced in Senate
Postal Vehicle Modernization Act,2021-03-08T05:00:00+00:00,2021-03-08T05:00:00+00:00,Introduced in House
"Supporting the designation of the week of April 26 through April 30, 2021, as ""National Specialized Instructional Support Personnel Appreciation Week"".",2021-04-28T04:00:00+00:00,2021-04-28T04:00:00+00:00,Introduced in House
America Wins Act,2021-05-18T04:00:00+00:00,2021-05-19T04:00:00+00:00,Referred to the Subcommittee on Aviation.
State and Local Digital Service Act of 2021,2021-11-01T04:00:00+00:00,2021-12-02T05:00:00+00:00,Committee Consideration and Mark-up Session Held.
UNSHACKLE Act,2021-03-11T05:00:00+00:00,2021-03-11T05:00:00+00:00,Introduced in Senate
Preventing HEAT Illness and Deaths Act of 2021,2021-09-20T04:00:00+00:00,2021-09-21T04:00:00+00:00,Referred to the Subcommittee on Health.
Outdoor Restoration Partnership Act of 2021,2021-04-20T04:00:00+00:00,2021-04-20T04:00:00+00:00,Introduced in Senate
Stop the Shutdowns Act,2021-03-29T04:00:00+00:00,2021-03-29T04:00:00+00:00,Introduced in House
Northern Rockies Ecosystem Protection Act,2021-04-21T04:00:00+00:00,2021-04-21T04:00:00+00:00,Introduced in Senate
Fossil Free Finance Act,2021-09-14T04:00:00+00:00,2021-09-14T04:00:00+00:00,Introduced in House
"To make revisions in title 51, United States Code, as necessary to keep the title current, and to make technical amendments to improve the United States Code.",2021-11-16T05:00:00+00:00,2021-12-09T05:00:00+00:00,Received in the Senate and Read twice and referred to the Committee on the Judiciary.
Rebuild Rural America Act of 2021,2021-04-05T04:00:00+00:00,2021-06-07T04:00:00+00:00,"Referred to the Subcommittee on Commodity Exchanges, Energy, and Credit."
FRESH Trucking Act,2021-01-19T05:00:00+00:00,2021-02-04T05:00:00+00:00,Referred to the Subcommittee on Highways and Transit.
Conservation and Innovative Climate Partnership Act of 2021,2021-04-15T04:00:00+00:00,2021-04-15T04:00:00+00:00,Introduced in Senate
"A bill to establish a Global Climate Change Resilience Strategy, to authorize the admission of climate-displaced persons, and for other purposes.",2021-04-22T04:00:00+00:00,2021-04-22T04:00:00+00:00,Introduced in Senate
Trade Preferences and American Manufacturing Competitiveness Act of 2021,2021-06-22T04:00:00+00:00,2021-06-22T04:00:00+00:00,Introduced in House
SMART Energy Act,2021-11-16T05:00:00+00:00,2021-11-16T05:00:00+00:00,Introduced in Senate
PARIS Act,2021-01-21T05:00:00+00:00,2021-01-21T05:00:00+00:00,Introduced in House
Paris Agreement Constitutional Treaty Act,2021-01-21T05:00:00+00:00,2021-01-21T05:00:00+00:00,Introduced in House
RESPOND Act of 2021,2021-03-04T05:00:00+00:00,2021-03-04T05:00:00+00:00,Introduced in Senate
21st Century Conservation Corps Act,2021-02-18T05:00:00+00:00,2021-02-18T05:00:00+00:00,Introduced in House
Honduras Human Rights and Anti-Corruption Act of 2021,2021-02-23T05:00:00+00:00,2021-02-23T05:00:00+00:00,Introduced in Senate
"A resolution expressing the sense of the Senate that the United States must seize the opportunity to create millions of jobs, become a net exporter of clean energy, and secure a better, more equitable future by accelerating the electrification of households, buildings, and businesses in the United States, modernizing the United States electricity grid, and continuing on the path towards decarbonizing electricity generation in the United States by 2035.",2021-05-18T04:00:00+00:00,2021-05-18T04:00:00+00:00,Introduced in Senate
Fostering and Realizing Electrification by Encouraging Zero Emission Refrigeration Trucks Act of 2021,2021-02-25T05:00:00+00:00,2021-02-26T05:00:00+00:00,Referred to the Subcommittee on Highways and Transit.
LIFT Act,2021-07-29T04:00:00+00:00,2021-07-29T04:00:00+00:00,Introduced in Senate
America’s Revegetation and Carbon Sequestration Act of 2021,2021-09-23T04:00:00+00:00,2021-10-21T04:00:00+00:00,Committee on Energy and Natural Resources. Hearings held.
"Reaffirming bilateral and multilateral relations between the United States and African countries and recognizing the importance of diplomatic, security, and trade relations.",2021-03-18T04:00:00+00:00,2021-03-18T04:00:00+00:00,Introduced in House
"Expressing support for the designation of May 7, 2021, as a ""National Day of Reason"" and recognizing the central importance of reason in the betterment of humanity.",2021-04-28T04:00:00+00:00,2021-04-28T04:00:00+00:00,Introduced in House
Generalized System of Preferences and Miscellaneous Tariff Bill Modernization Act of 2021,2021-06-17T04:00:00+00:00,2021-06-17T04:00:00+00:00,Introduced in House
Tax on Wall Street Speculation Act,2021-04-21T04:00:00+00:00,2021-04-21T04:00:00+00:00,Introduced in Senate
RESPOND Act of 2021,2021-03-08T05:00:00+00:00,2021-03-08T05:00:00+00:00,Introduced in House
Bank Merger Review Modernization Act of 2021,2021-09-29T04:00:00+00:00,2021-09-29T04:00:00+00:00,Introduced in Senate
No Taxpayer Funding for Paris Climate Agreement Act,2021-01-21T05:00:00+00:00,2021-01-21T05:00:00+00:00,Introduced in House
Justice for Black Farmers Act of 2021,2021-02-26T05:00:00+00:00,2021-04-28T04:00:00+00:00,"Referred to the Subcommittee on the Constitution, Civil Rights, and Civil Liberties."
Resilient Schools Act of 2021,2021-06-24T04:00:00+00:00,2021-06-24T04:00:00+00:00,Introduced in Senate
"Recognizing that it is the duty of the Federal Government to develop and implement a Roadmap to Freedom in order to overhaul the outdated immigration system in the United States that has gone without significant reform for decades, and to relieve the great human impact an unjust system bears on communities around the country.",2021-01-28T05:00:00+00:00,2021-01-29T05:00:00+00:00,"Referred to the Subcommittee on Border Security, Facilitation, and Operations."
THRIVE Act,2021-04-30T04:00:00+00:00,2021-05-03T04:00:00+00:00,Referred to the Subcommittee on Highways and Transit.
PIPE Act,2021-06-04T04:00:00+00:00,2021-06-07T04:00:00+00:00,Referred to the Subcommittee on Water Resources and Environment.
21st Century Jobs Act,2021-07-16T04:00:00+00:00,2021-07-19T04:00:00+00:00,Referred to the Subcommittee on Environment and Climate Change.
Safe Schools Improvement Act of 2021,2021-07-01T04:00:00+00:00,2021-07-01T04:00:00+00:00,Introduced in House
Smaller Class Sizes for Students and Educators Act of 2021,2021-11-18T05:00:00+00:00,2021-11-18T05:00:00+00:00,Introduced in Senate
Protecting New Mexico’s Jobs and Public Education System Act,2021-02-03T05:00:00+00:00,2021-03-01T05:00:00+00:00,Referred to the Subcommittee on Energy and Mineral Resources.
THRIVE Act,2021-04-29T04:00:00+00:00,2021-04-29T04:00:00+00:00,Introduced in Senate
"Chesapeake Bay Science, Education, and Ecosystem Enhancement Act of 2021",2021-05-25T04:00:00+00:00,2021-05-25T04:00:00+00:00,Introduced in Senate
Ending Corporal Punishment in Schools Act of 2021,2021-02-23T05:00:00+00:00,2021-02-23T05:00:00+00:00,Introduced in House
Sustainable Agriculture Research Act,2021-02-25T05:00:00+00:00,2021-04-05T04:00:00+00:00,"Referred to the Subcommittee on Biotechnology, Horticulture, and Research."
Expressing the sense of the House of Representatives that the United States should formally withdraw from the Paris Agreement.,2021-02-11T05:00:00+00:00,2021-02-11T05:00:00+00:00,Introduced in House
Expressing support for the NATO alliance and increased alliance cooperation on opportunities and challenges.,2021-06-14T04:00:00+00:00,2021-08-04T04:00:00+00:00,"Referred to the Subcommittee on Europe, Energy, the Environment and Cyber."
Insular Area Climate Change Act,2021-03-04T05:00:00+00:00,2021-07-14T04:00:00+00:00,Committee Consideration and Mark-up Session Held.
Federal Home Loan Banks’ Mission Implementation Act,2021-05-18T04:00:00+00:00,2021-05-18T04:00:00+00:00,Introduced in House
"Recognizing the duty of the Federal Government to implement an agenda to Transform, Heal, and Renew by Investing in a Vibrant Economy (""THRIVE"").",2021-02-05T05:00:00+00:00,2021-02-18T05:00:00+00:00,Referred to the Subcommittee for Indigenous Peoples of the United States.
Naturally Offsetting Emissions by Managing and Implementing Tillage Strategies Act of 2021,2021-04-14T04:00:00+00:00,2021-04-14T04:00:00+00:00,Introduced in House
American Renewable Energy Act of 2021,2021-06-16T04:00:00+00:00,2021-06-17T04:00:00+00:00,Referred to the Subcommittee on Energy.
Recognizing the duty of the Federal Government to create a Green Real Deal.,2021-07-29T04:00:00+00:00,2021-07-30T04:00:00+00:00,Referred to the Subcommittee on Environment and Climate Change.
PEAKER Act of 2021,2021-05-12T04:00:00+00:00,2021-05-13T04:00:00+00:00,Referred to the Subcommittee on Energy.
"Monarch Action, Recovery, and Conservation of Habitat Act of 2021",2021-03-17T04:00:00+00:00,2021-03-17T04:00:00+00:00,Introduced in Senate
Energy Sector Innovation Credit Act of 2021,2021-07-27T04:00:00+00:00,2021-07-27T04:00:00+00:00,Introduced in Senate
SAFE Act,2021-04-28T04:00:00+00:00,2022-01-19T05:00:00+00:00,Subcommittee on Energy and Mineral Resources Discharged.
CROOK Act,2021-01-21T05:00:00+00:00,2021-04-21T04:00:00+00:00,Committee Consideration and Mark-up Session Held.
Expressing the sense of the House of Representatives that it is the duty of the Federal Government to dramatically expand and strengthen the care economy.,2021-03-01T05:00:00+00:00,2021-05-18T04:00:00+00:00,"Referred to the Subcommittee on the Constitution, Civil Rights, and Civil Liberties."
Climate-Resilient International Development Optimization Act,2021-04-22T04:00:00+00:00,2021-04-22T04:00:00+00:00,Introduced in House
"Department of Homeland Security Appropriations Act, 2022",2021-07-15T04:00:00+00:00,2021-07-15T04:00:00+00:00,Introduced in House
"Agriculture, Rural Development, Food and Drug Administration, and Related Agencies Appropriations Act, 2022",2021-07-02T04:00:00+00:00,2021-07-02T04:00:00+00:00,Introduced in House
"Transportation, Housing and Urban Development, and Related Agencies Appropriations Act, 2022",2021-07-20T04:00:00+00:00,2021-07-20T04:00:00+00:00,Introduced in House
"Military Construction, Veterans Affairs, and Related Agencies Appropriations Act, 2022",2021-07-02T04:00:00+00:00,2021-07-02T04:00:00+00:00,Introduced in House
A joint resolution recognizing the duty of the Federal Government to create a Green New Deal.,2019-02-13T05:00:00+00:00,2019-03-26T04:00:00+00:00,Motion to proceed to measure considered in Senate. (CR S1964)
A joint resolution calling on the United States and Congress to take immediate action to address the challenge of climate change.,2019-02-28T05:00:00+00:00,2019-02-28T05:00:00+00:00,Introduced in Senate
Ending Corporal Punishment in Schools Act of 2019,2019-01-23T05:00:00+00:00,2019-01-23T05:00:00+00:00,Introduced in House
Blue Carbon for Our Planet Act,2020-06-11T04:00:00+00:00,2020-06-11T04:00:00+00:00,Introduced in Senate
Blue Carbon for Our Planet Act,2020-01-13T05:00:00+00:00,2020-11-17T05:00:00+00:00,"Subcommittee on Water, Oceans, and Wildlife Discharged."
Full-Service Community School Expansion Act of 2020,2020-10-26T04:00:00+00:00,2020-10-26T04:00:00+00:00,Introduced in Senate
Atmospheric Climate Intervention Research Act,2019-12-19T05:00:00+00:00,2020-03-04T05:00:00+00:00,Subcommittee Consideration and Mark-up Session Held.
Clean Energy Future Through Innovation Act of 2020,2020-12-28T05:00:00+00:00,2020-12-29T05:00:00+00:00,"Referred to the Subcommittee on Railroads, Pipelines, and Hazardous Materials."
Anti-Corruption and Public Integrity Act,2020-12-18T05:00:00+00:00,2020-12-18T05:00:00+00:00,Introduced in House
Jobs for All Act,2019-02-06T05:00:00+00:00,2019-02-06T05:00:00+00:00,Introduced in House
HONEST Enterprise Act,2020-12-04T05:00:00+00:00,2020-12-04T05:00:00+00:00,Introduced in House
Improving Pandemic Preparedness and Response Through Diplomacy Act,2020-06-30T04:00:00+00:00,2020-06-30T04:00:00+00:00,Introduced in Senate
Coast Guard Authorization Act of 2019,2019-06-21T04:00:00+00:00,2019-07-25T04:00:00+00:00,"Received in the Senate and Read twice and referred to the Committee on Commerce, Science, and Transportation."
"A bill to establish aviation accession training programs for the Commissioned Officer Corps of the National Oceanic and Atmospheric Administration to prepare students for commissioned service as pilots in the Corps, and for other purposes.",2019-11-20T05:00:00+00:00,2019-11-20T05:00:00+00:00,Introduced in Senate
A resolution recognizing the duty of the Federal Government to create a Green New Deal.,2019-02-07T05:00:00+00:00,2019-02-07T05:00:00+00:00,Introduced in Senate
STEM Opportunities Act of 2019,2019-05-07T04:00:00+00:00,2019-10-15T04:00:00+00:00,"Received in the Senate and Read twice and referred to the Committee on Health, Education, Labor, and Pensions."
Research to Reduce Agricultural Methane Act,2020-12-18T05:00:00+00:00,2020-12-18T05:00:00+00:00,Introduced in House
BE HEARD in the Workplace Act,2019-04-09T04:00:00+00:00,2019-05-03T04:00:00+00:00,"Referred to the Subcommittee on the Constitution, Civil Rights, and Civil Liberties."
