Western Water Security Act of 2020,2019-10-28T04:00:00+00:00,2020-12-18T05:00:00+00:00,"Reported (Amended) by the Committee on Natural Resources. H. Rept. 116-674, Part I."
Expressing support for the designation of September 2019 as National Campus Sexual Assault Awareness Month.,2019-09-26T04:00:00+00:00,2019-09-26T04:00:00+00:00,Introduced in House
Justice for Black Farmers Act of 2020,2020-11-30T05:00:00+00:00,2020-11-30T05:00:00+00:00,Introduced in Senate
Supporting the Farmers Bill of Rights.,2020-02-06T05:00:00+00:00,2020-02-06T05:00:00+00:00,Introduced in House
"Bolstering Long-Term Understanding and Exploration of the Great Lakes, Oceans, Bays, and Estuaries Act",2019-06-27T04:00:00+00:00,2020-11-17T05:00:00+00:00,"Subcommittee on Water, Oceans, and Wildlife Discharged."
Combating Implicit Bias in Education Act,2019-10-21T04:00:00+00:00,2019-10-21T04:00:00+00:00,Introduced in House
Recognizing the 4th anniversary of the adoption of the international Paris Agreement on climate change.,2019-12-12T05:00:00+00:00,2019-12-13T05:00:00+00:00,Referred to the Subcommittee on Environment and Climate Change.
Declaring racism a public health crisis.,2020-07-29T04:00:00+00:00,2020-07-29T04:00:00+00:00,Introduced in House
Healthy Climate and Family Security Act of 2019,2019-03-28T04:00:00+00:00,2019-03-28T04:00:00+00:00,Introduced in Senate
Energy PRICE Act,2020-02-03T05:00:00+00:00,2020-02-03T05:00:00+00:00,Introduced in House
Wildlife Corridors Conservation Act of 2019,2019-05-16T04:00:00+00:00,2019-05-16T04:00:00+00:00,Introduced in Senate
STEM Opportunities Act of 2019,2019-09-26T04:00:00+00:00,2019-09-26T04:00:00+00:00,Introduced in Senate
Hudson River Climate Change Protection Act,2020-06-15T04:00:00+00:00,2020-06-16T04:00:00+00:00,Referred to the Subcommittee on Water Resources and Environment.
Climate Solutions Act of 2019,2019-01-08T05:00:00+00:00,2019-01-25T05:00:00+00:00,Referred to the Subcommittee on Environment and Climate Change.
Surface Transportation Research and Development Act of 2020,2020-06-15T04:00:00+00:00,2020-06-16T04:00:00+00:00,Referred to the Subcommittee on Highways and Transit.
Climate Risk Disclosure Act of 2019,2019-07-05T04:00:00+00:00,2020-10-27T04:00:00+00:00,"Reported (Amended) by the Committee on Financial Services. H. Rept. 116-563, Part I."
National Defense Authorization Act for Fiscal Year 2021,2020-06-23T04:00:00+00:00,2020-08-07T14:52:46+00:00,Held at the desk.
Combating Military Sexual Assault Act,2019-05-15T04:00:00+00:00,2019-05-15T04:00:00+00:00,Introduced in Senate
TREE Act of 2020,2020-06-23T04:00:00+00:00,2020-06-23T04:00:00+00:00,Introduced in Senate
Modernizing America with Rebuilding to Kickstart the Economy of the Twenty-first Century with a Historic Infrastructure-Centered Expansion Act,2019-09-26T04:00:00+00:00,2019-10-18T04:00:00+00:00,Referred to the Subcommittee on Energy and Mineral Resources.
National Defense Authorization Act for Fiscal Year 2021,2020-03-26T04:00:00+00:00,2021-01-02T05:00:00+00:00,Message on Senate action sent to the House.
Expressing support for the designation of September 2020 as National Campus Sexual Assault Awareness Month.,2020-08-25T04:00:00+00:00,2020-08-25T04:00:00+00:00,Introduced in House
"To establish requirements on accelerated filers receiving Federal aid related to COVID-19, to establish requirements on all corporations until Federal aid related to COVID-19 is repaid, and for other purposes.",2020-03-23T04:00:00+00:00,2020-03-23T04:00:00+00:00,Introduced in House
Leading Infrastructure for Tomorrow’s America Act,2019-05-15T04:00:00+00:00,2019-06-04T04:00:00+00:00,Referred to the Subcommittee on Energy and Mineral Resources.
Supporting Survivors of Sexual Harassment in Schools Act of 2020,2020-09-08T04:00:00+00:00,2020-09-08T04:00:00+00:00,Introduced in House
PUGET SOS Act,2019-04-10T04:00:00+00:00,2020-02-10T05:00:00+00:00,Received in the Senate and Read twice and referred to the Committee on Environment and Public Works.
Climate Change Resiliency Fund for America Act of 2019,2019-03-12T04:00:00+00:00,2019-03-13T04:00:00+00:00,Referred to the Subcommittee on Coast Guard and Maritime Transportation.
Nuclear Energy Research and Development Act,2020-03-05T05:00:00+00:00,2020-03-12T04:00:00+00:00,Subcommittee Consideration and Mark-up Session Held.
Climate Change Health Protection and Promotion Act of 2019,2019-02-14T05:00:00+00:00,2019-02-15T05:00:00+00:00,Referred to the Subcommittee on Health.
Providing amounts for the expenses of the Select Committee on the Climate Crisis and the Select Committee on the Modernization of Congress.,2019-01-29T05:00:00+00:00,2019-02-07T19:46:20+00:00,"Passed/agreed to in House: Pursuant to the provisions of H. Res. 105, H. Res. 86 is considered passed House."
Castner Range National Monument Act,2020-03-12T04:00:00+00:00,2020-03-31T04:00:00+00:00,"Referred to the Subcommittee on National Parks, Forests, and Public Lands."
Targeting Environmental and Climate Recklessness Act of 2019,2020-01-16T05:00:00+00:00,2020-02-07T05:00:00+00:00,Referred to the Subcommittee on Immigration and Citizenship.
Department of Homeland Security Climate Change Research Act,2019-10-18T04:00:00+00:00,2020-02-11T05:00:00+00:00,Received in the Senate and Read twice and referred to the Committee on Homeland Security and Governmental Affairs.
Safe Schools Improvement Act of 2019,2019-05-09T04:00:00+00:00,2019-05-09T04:00:00+00:00,Introduced in House
WPA Act,2020-07-01T04:00:00+00:00,2020-07-01T04:00:00+00:00,Introduced in House
Fish Act of 2019,2019-10-17T04:00:00+00:00,2020-01-14T05:00:00+00:00,Subcommittee Hearings Held.
Climate Equity Act of 2020,2020-08-06T04:00:00+00:00,2020-08-06T04:00:00+00:00,Introduced in Senate
INVEST in America Act,2020-06-04T04:00:00+00:00,2020-06-05T04:00:00+00:00,Referred to the Subcommittee on Highways and Transit.
Campus Accountability and Safety Act,2019-04-01T04:00:00+00:00,2019-04-01T04:00:00+00:00,Introduced in Senate
Department of Defense Climate Resiliency and Readiness Act,2019-05-15T04:00:00+00:00,2019-05-15T04:00:00+00:00,Introduced in Senate
Protecting Communities from Liquefied Natural Gas Trains Act,2019-09-12T04:00:00+00:00,2019-09-13T04:00:00+00:00,"Referred to the Subcommittee on Railroads, Pipelines, and Hazardous Materials."
Women and Climate Change Act of 2019,2019-03-26T04:00:00+00:00,2019-03-27T04:00:00+00:00,Referred to the Subcommittee on Environment and Climate Change.
Climate Agricultural Conservation Practices Act,2020-12-09T05:00:00+00:00,2020-12-09T05:00:00+00:00,Introduced in House
Addressing Teacher Shortages Act of 2019,2019-07-31T04:00:00+00:00,2019-07-31T04:00:00+00:00,Introduced in Senate
"A resolution to recognize the 50th anniversary of Earth Day and the leadership of its founder, Senator Gaylord Nelson.",2020-05-20T04:00:00+00:00,2020-05-20T04:00:00+00:00,Introduced in Senate
MONARCH Act of 2020,2020-02-14T05:00:00+00:00,2020-03-05T05:00:00+00:00,Referred to the Subcommittee on Conservation and Forestry.
Coastal State Climate Preparedness Act of 2019,2019-06-27T04:00:00+00:00,2019-11-15T05:00:00+00:00,Reported by the Committee on Natural Resources. H. Rept. 116-294.
Global Investment in American Jobs Act of 2020,2020-07-23T04:00:00+00:00,2020-07-23T04:00:00+00:00,Introduced in House
Community Parks Revitalization Act,2020-09-14T04:00:00+00:00,2020-09-22T04:00:00+00:00,"Referred to the Subcommittee on National Parks, Forests, and Public Lands."
Aid for Trade Act of 2019,2019-04-03T04:00:00+00:00,2019-04-03T04:00:00+00:00,Introduced in House
REAADI for Disasters Act,2019-06-10T04:00:00+00:00,2019-06-10T04:00:00+00:00,Introduced in Senate
National Defense Authorization Act for Fiscal Year 2020,2019-06-11T04:00:00+00:00,2019-12-20T05:00:00+00:00,Signed by President.
Clean Energy Standard Act of 2019,2019-05-08T04:00:00+00:00,2019-05-08T04:00:00+00:00,Introduced in Senate
"Financial Protections and Assistance for America’s Consumers, States, Businesses, and Vulnerable Populations Act",2020-03-23T04:00:00+00:00,2020-03-23T04:00:00+00:00,Introduced in House
Green New Deal for Public Housing Act,2019-11-19T05:00:00+00:00,2019-12-05T05:00:00+00:00,Sponsor introductory remarks on measure. (CR H9284)
COVID–19 International Response and Recovery Act of 2020,2020-05-07T04:00:00+00:00,2020-05-07T04:00:00+00:00,Introduced in Senate
Central America Reform and Enforcement Act,2019-05-14T04:00:00+00:00,2019-05-14T04:00:00+00:00,Introduced in Senate
Success in the Middle Act of 2019,2019-06-04T04:00:00+00:00,2019-06-04T04:00:00+00:00,Introduced in House
Systemic Risk Mitigation Act of 2020,2020-04-14T04:00:00+00:00,2020-04-14T04:00:00+00:00,Introduced in House
Inclusive Prosperity Act of 2019,2019-05-22T04:00:00+00:00,2019-05-22T04:00:00+00:00,Introduced in Senate
Coordinated Ocean Observations and Research Act of 2020,2019-03-27T04:00:00+00:00,2020-12-31T05:00:00+00:00,Signed by President.
Clean Energy Standard Act of 2019,2019-05-08T04:00:00+00:00,2019-05-09T04:00:00+00:00,Referred to the Subcommittee on Energy.
Super Pollutants Act of 2019,2019-08-02T04:00:00+00:00,2019-08-05T04:00:00+00:00,Referred to the Subcommittee on Environment and Climate Change.
Child Trafficking Victims Protection and Welfare Act of 2019,2019-03-05T05:00:00+00:00,2019-03-05T05:00:00+00:00,Introduced in Senate
Clean Economy Act of 2020,2020-02-11T05:00:00+00:00,2020-02-11T05:00:00+00:00,Introduced in Senate
National Security Resiliency and Sustainability Act of 2020,2020-06-30T04:00:00+00:00,2020-06-30T04:00:00+00:00,Introduced in House
PROSWIFT Act,2019-11-22T05:00:00+00:00,2020-01-09T05:00:00+00:00,Committee Consideration and Mark-up Session Held.
Climate Smart Ports Act,2020-05-27T04:00:00+00:00,2020-05-27T04:00:00+00:00,Introduced in House
Incentivizing Value Capture for Greener Transportation Act,2020-01-16T05:00:00+00:00,2020-01-17T05:00:00+00:00,Referred to the Subcommittee on Highways and Transit.
"Recognizing the International Year of the Salmon in 2019 as a framework of collaboration across the Northern Hemisphere to sustain and recover salmon stocks through research, partnerships, and public action.",2019-06-04T04:00:00+00:00,2019-06-04T04:00:00+00:00,Introduced in House
Environmental Justice Act of 2019,2019-07-23T04:00:00+00:00,2019-07-23T04:00:00+00:00,Introduced in Senate
STRONG Act,2019-01-29T05:00:00+00:00,2019-02-07T05:00:00+00:00,"Referred to the Subcommittee on Economic Development, Public Buildings, and Emergency Management."
"Recognizing World Oceans Day and the necessity to protect, conserve, maintain, and rebuild our oceans and its resources.",2019-06-05T04:00:00+00:00,2019-06-06T04:00:00+00:00,"Referred to the Subcommittee on Water, Oceans, and Wildlife."
Providing for the expenses of certain committees of the House of Representatives in the One Hundred Sixteenth Congress.,2019-03-21T04:00:00+00:00,2019-03-27T21:38:19+00:00,Motion to reconsider laid on the table Agreed to without objection.
Encouraging the Architect of the Capitol to transition to the exclusive use of electricity derived from renewable energy sources to power the United States Capitol Complex by 2032.,2019-11-14T05:00:00+00:00,2020-11-15T05:00:00+00:00,"Referred to the Subcommittee on Economic Development, Public Buildings, and Emergency Management."
Combating Sexual Harassment in Science Act of 2019,2019-04-08T04:00:00+00:00,2019-04-08T04:00:00+00:00,Introduced in Senate
Weatherization Enhancement and Local Energy Efficiency Investment and Accountability Act,2019-04-02T04:00:00+00:00,2019-07-17T04:00:00+00:00,Committee Consideration and Mark-up Session Held.
Intelligence Authorization Act for Fiscal Year 2021,2020-07-30T04:00:00+00:00,2020-10-30T04:00:00+00:00,Reported by the Committee on Intelligence. H. Rept. 116-565.
Public School Green Rooftop Program,2020-07-20T04:00:00+00:00,2020-07-20T04:00:00+00:00,Introduced in House
Saline Lake Ecosystems in the Great Basin States Program Act of 2020,2020-07-02T04:00:00+00:00,2020-07-02T04:00:00+00:00,Introduced in Senate
"To direct the Secretary of Commerce, acting through the Administrator of the National Oceanic and Atmospheric Administration, to establish a National Coastal Data Information System, and for other purposes.",2020-11-12T05:00:00+00:00,2020-11-12T05:00:00+00:00,Introduced in House
Restructuring Environmentally Sound Pensions in Order to Negate Disaster Act of 2020,2020-11-17T05:00:00+00:00,2020-11-17T05:00:00+00:00,Introduced in House
No Bonuses During Blackouts Act of 2019,2019-11-22T05:00:00+00:00,2019-11-22T05:00:00+00:00,Introduced in House
CROOK Act,2019-12-11T05:00:00+00:00,2019-12-11T05:00:00+00:00,Introduced in Senate
Patsy T. Mink and Louise M. Slaughter Gender Equity in Education Act of 2019,2019-06-25T04:00:00+00:00,2019-06-25T04:00:00+00:00,Introduced in Senate
Weatherization Enhancement and Local Energy Efficiency Investment and Accountability Act of 2019,2019-04-02T04:00:00+00:00,2019-09-10T04:00:00+00:00,Committee on Energy and Natural Resources. Reported by Senator Murkowski without amendment. With written report No. 116-82.
SWAP Act,2019-07-25T04:00:00+00:00,2019-07-26T04:00:00+00:00,Referred to the Subcommittee on Consumer Protection and Commerce.
Combating Military Sexual Assault Act,2019-05-23T04:00:00+00:00,2019-05-24T04:00:00+00:00,Referred to the Subcommittee on Military Personnel.
Growing Climate Solutions Act of 2020,2020-06-26T04:00:00+00:00,2020-06-26T04:00:00+00:00,Introduced in House
Honoring the 200th anniversary of the founding of Colgate University.,2019-06-04T04:00:00+00:00,2019-06-04T04:00:00+00:00,Introduced in House
Global Migration Agreement Act,2020-02-12T05:00:00+00:00,2020-03-10T04:00:00+00:00,Referred to the Subcommittee on Immigration and Citizenship.
FUTURE of Artificial Intelligence Act of 2020,2020-07-09T04:00:00+00:00,2020-07-09T04:00:00+00:00,Introduced in House
Climate Change Health Protection and Promotion Act of 2019,2019-02-14T05:00:00+00:00,2019-02-14T05:00:00+00:00,Introduced in Senate
"Chesapeake Bay Science, Education, and Ecosystem Enhancement Act of 2019",2020-01-27T05:00:00+00:00,2020-01-28T05:00:00+00:00,"Referred to the Subcommittee on Water, Oceans, and Wildlife."
Green Transportation Act,2019-07-18T04:00:00+00:00,2019-07-19T04:00:00+00:00,Referred to the Subcommittee on Highways and Transit.
"Recognizing the significance of the 550th birth anniversary of Guru Nanak, the founder of Sikhism, to Sikh Americans and Sikhs worldwide.",2019-11-12T05:00:00+00:00,2019-11-12T05:00:00+00:00,Introduced in House
"Recognizing the duty of the Federal Government to implement an agenda to Transform, Heal, and Renew by Investing in a Vibrant Economy (""THRIVE"").",2020-09-11T04:00:00+00:00,2020-09-16T04:00:00+00:00,Referred to the Subcommittee for Indigenous Peoples of the United States.
Green Climate Fund Authorization Act of 2019,2019-11-05T05:00:00+00:00,2019-11-05T05:00:00+00:00,Introduced in House
Federal Jobs Guarantee Development Act of 2019,2019-09-10T04:00:00+00:00,2019-09-10T04:00:00+00:00,Introduced in Senate
Stop Sexual Harassment in K–12 Act,2020-09-17T04:00:00+00:00,2020-09-17T04:00:00+00:00,Introduced in House
Securing American Leadership in Science and Technology Act of 2020,2020-01-28T05:00:00+00:00,2020-03-10T04:00:00+00:00,"Referred to the Subcommittee on Courts, Intellectual Property, and the Internet."
Climate Equity Act of 2020,2020-08-11T04:00:00+00:00,2020-08-11T04:00:00+00:00,Introduced in House
Environmental Justice For All Act,2020-02-27T05:00:00+00:00,2020-10-01T04:00:00+00:00,Committee Hearings Held.
Northern Rockies Ecosystem Protection Act,2019-02-22T05:00:00+00:00,2019-03-07T05:00:00+00:00,"Referred to the Subcommittee on National Parks, Forests, and Public Lands."
"A bill to prohibit the use of funds to Federal agencies to establish a panel, task force, advisory committee, or other effort to challenge the scientific consensus on climate change, and for other purposes.",2019-03-07T05:00:00+00:00,2019-03-11T04:00:00+00:00,Read the second time. Placed on Senate Legislative Calendar under General Orders. Calendar No. 35.
Water for Tomorrow Act of 2020,2020-07-02T04:00:00+00:00,2020-07-22T04:00:00+00:00,Committee on Energy and Natural Resources Subcommittee on Water and Power. Hearings held.
Keeping All Students Safe Act,2020-11-30T05:00:00+00:00,2020-11-30T05:00:00+00:00,Introduced in Senate
"Damon Paul Nelson and Matthew Young Pollard Intelligence Authorization Act for Fiscal Years 2018, 2019, and 2020",2019-06-26T04:00:00+00:00,2019-07-18T04:00:00+00:00,Received in the Senate and Read twice and referred to the Select Committee on Intelligence.
REAADI for Disasters Act,2019-06-11T04:00:00+00:00,2019-06-12T04:00:00+00:00,"Referred to the Subcommittee on Economic Development, Public Buildings, and Emergency Management."
Recognizing the duty of the Federal Government to create a Green Real Deal.,2019-04-03T04:00:00+00:00,2019-05-03T04:00:00+00:00,"Referred to the Subcommittee on Antitrust, Commercial, and Administrative Law."
Climate and Health Protection Act,2019-07-18T04:00:00+00:00,2019-07-19T04:00:00+00:00,Referred to the Subcommittee on Health.
America's Transportation Infrastructure Act of 2019,2019-07-29T04:00:00+00:00,2020-01-08T05:00:00+00:00,By Senator Barrasso from Committee on Environment and Public Works filed written report. Report No. 116-200.
Department of Defense Ethics and Anti-corruption Act of 2019,2019-09-10T04:00:00+00:00,2019-09-25T04:00:00+00:00,"Referred to the Subcommittee on Crime, Terrorism, and Homeland Security."
"Natural Gas Blowout Prevention, Oversight, and Liability Act of 2020",2020-08-12T04:00:00+00:00,2020-08-12T04:00:00+00:00,Introduced in Senate
Break Free From Plastic Pollution Act of 2020,2020-02-11T05:00:00+00:00,2020-02-12T05:00:00+00:00,Referred to the Subcommittee on Water Resources and Environment.
National Climate Bank Act,2019-07-08T04:00:00+00:00,2019-07-08T04:00:00+00:00,Introduced in Senate
"A resolution recognizing 2019 as the International Year of the Salmon, a framework of collaboration across the Northern Hemisphere to sustain and recover salmon stocks through research, partnerships, and public action.",2019-06-13T04:00:00+00:00,2019-06-13T04:00:00+00:00,Introduced in Senate
"A concurrent resolution recognizing that the climate crisis is disproportionately affecting the health, economic opportunity, and fundamental rights of children, expressing the sense of Congress that renewed leadership by the United States is needed to address the climate crisis, and recognizing the need of the United States to develop a national, comprehensive, and science-based climate recovery plan to phase out fossil fuel emissions, protect and enhance natural sequestration, and put the United States on a path toward stabilizing the climate system.",2020-09-23T04:00:00+00:00,2020-09-23T04:00:00+00:00,Introduced in Senate
Climate PREP Act,2020-09-24T04:00:00+00:00,2020-09-24T04:00:00+00:00,Introduced in Senate
Encouraging the Environmental Protection Agency to maintain and strengthen requirements under the Clean Water Act and reverse ongoing administrative actions to weaken this landmark law and protections for United States waters.,2020-01-14T05:00:00+00:00,2020-01-15T05:00:00+00:00,Referred to the Subcommittee on Water Resources and Environment.
Grid Security Research and Development Act,2020-02-05T05:00:00+00:00,2020-09-30T04:00:00+00:00,Received in the Senate and Read twice and referred to the Committee on Energy and Natural Resources.
Challenges & Prizes for Climate Act of 2019,2019-06-05T04:00:00+00:00,2019-06-05T04:00:00+00:00,Introduced in House
Targeting Environmental and Climate Recklessness Act of 2019,2019-11-21T05:00:00+00:00,2019-11-21T05:00:00+00:00,Introduced in Senate
Success in the Middle Act of 2019,2019-06-04T04:00:00+00:00,2019-06-04T04:00:00+00:00,Introduced in Senate
Climate Change Diplomacy and Development Act of 2020,2020-12-17T05:00:00+00:00,2020-12-17T05:00:00+00:00,Introduced in House
Climate-Ready Fisheries Act of 2019,2019-10-15T04:00:00+00:00,2020-12-14T05:00:00+00:00,Reported by the Committee on Natural Resources. H. Rept. 116-642.
Hydropower Clean Energy Future Act,2020-06-29T04:00:00+00:00,2020-06-29T04:00:00+00:00,Introduced in House
Climate Action Now Act,2019-03-27T04:00:00+00:00,2019-05-07T04:00:00+00:00,Read the second time. Placed on Senate Legislative Calendar under General Orders. Calendar No. 79.
Climate Security Intelligence Act of 2019,2019-06-05T04:00:00+00:00,2019-06-05T04:00:00+00:00,Introduced in House
Fossil Energy Research and Development Act of 2019,2019-07-02T04:00:00+00:00,2020-09-17T04:00:00+00:00,"Reported (Amended) by the Committee on Science, Space, and Technology. H. Rept. 116-510."
Retirees Sustainable Investment Policies Act of 2020,2020-12-14T05:00:00+00:00,2020-12-14T05:00:00+00:00,Introduced in House
Ending PUSHOUT Act of 2019,2019-12-05T05:00:00+00:00,2019-12-05T05:00:00+00:00,Introduced in House
Climate Readiness Act of 2020,2020-03-05T05:00:00+00:00,2020-03-05T05:00:00+00:00,Introduced in House
FEMA Climate Change Preparedness Act,2020-01-16T05:00:00+00:00,2020-01-16T05:00:00+00:00,Introduced in Senate
National Aeronautics and Space Administration Authorization Act of 2020,2020-01-24T05:00:00+00:00,2020-01-29T05:00:00+00:00,Subcommittee Consideration and Mark-up Session Held.
Supporting Trauma-Informed Education Practices Act of 2019,2019-10-23T04:00:00+00:00,2019-10-23T04:00:00+00:00,Introduced in House
Jobs and Justice Act of 2020,2020-09-23T04:00:00+00:00,2020-09-24T04:00:00+00:00,Referred to the Subcommittee on Aviation.
Fishery Failures: Urgently Needed Disaster Declarations Act,2019-07-30T04:00:00+00:00,2020-12-21T23:40:00+00:00,Held at the desk.
Climate Change Education Act,2019-02-13T05:00:00+00:00,2019-02-13T05:00:00+00:00,Introduced in Senate
Air Source Heat Pump Act of 2020,2020-12-08T05:00:00+00:00,2020-12-08T05:00:00+00:00,Introduced in Senate
Recognizing the 5th anniversary of the adoption of the international Paris Agreement on climate change.,2020-12-10T05:00:00+00:00,2020-12-10T05:00:00+00:00,Introduced in House
Trillion Trees Act,2020-02-12T05:00:00+00:00,2020-02-26T05:00:00+00:00,Committee Hearings Held.
Climate Stewardship Act of 2019,2019-09-10T04:00:00+00:00,2019-09-10T04:00:00+00:00,Introduced in Senate
GREEN Building Jobs Act of 2020,2020-12-10T05:00:00+00:00,2020-12-10T05:00:00+00:00,Introduced in Senate
Sustainable Aviation Fuel Act,2020-11-18T05:00:00+00:00,2020-11-19T05:00:00+00:00,Referred to the Subcommittee on Aviation.
"Advancing Competitiveness, Transparency, and Security in the Americas Act of 2020",2020-10-30T04:00:00+00:00,2020-10-30T04:00:00+00:00,Introduced in House
BLUE Pacific Act,2020-07-27T04:00:00+00:00,2020-07-30T04:00:00+00:00,Sponsor introductory remarks on measure. (CR H3988-3989)
Teacher and School Leader Quality Partnership Grants Act,2019-09-19T04:00:00+00:00,2019-09-19T04:00:00+00:00,Introduced in House
Clean Energy Innovation and Deployment Act of 2020,2020-07-09T04:00:00+00:00,2020-07-10T04:00:00+00:00,Referred to the Subcommittee on Highways and Transit.
COASTAL Act,2019-08-01T04:00:00+00:00,2020-02-25T05:00:00+00:00,Committee on Energy and Natural Resources. Reported by Senator Murkowski with amendments. Without written report.
Comprehensive National Mercury Monitoring Act,2020-07-16T04:00:00+00:00,2020-07-16T04:00:00+00:00,Introduced in House
National Green Bank Act of 2019,2019-06-21T04:00:00+00:00,2019-06-24T04:00:00+00:00,Referred to the Subcommittee on Energy.
Utilizing Significant Emissions with Innovative Technologies Act,2019-02-13T05:00:00+00:00,2019-02-28T05:00:00+00:00,Referred to the Subcommittee on Energy and Mineral Resources.
21st Century Jobs Act,2020-10-27T04:00:00+00:00,2020-10-28T04:00:00+00:00,Referred to the Subcommittee on Highways and Transit.
"Expressing the sense of Congress that there is a climate emergency which demands a massive-scale mobilization to halt, reverse, and address its consequences and causes.",2019-07-09T04:00:00+00:00,2019-07-09T04:00:00+00:00,Introduced in House
America's Clean Future Fund Act,2020-08-06T04:00:00+00:00,2020-08-06T04:00:00+00:00,Introduced in Senate
USE IT Act,2019-02-07T05:00:00+00:00,2019-05-13T04:00:00+00:00,By Senator Barrasso from Committee on Environment and Public Works filed written report. Report No. 116-38.
"To direct the Secretary of Defense to include questions regarding supremacism, extremism, and racism in the workplace and equal opportunity, command climate, and workplace and gender relations surveys administered by the Office of People Analytics of the Department of Defense.",2019-06-10T04:00:00+00:00,2019-06-11T04:00:00+00:00,Referred to the Subcommittee on Military Personnel.
Combating Sexual Harassment in Science Act of 2019,2019-01-03T05:00:00+00:00,2019-07-24T04:00:00+00:00,"Received in the Senate and Read twice and referred to the Committee on Health, Education, Labor, and Pensions."
A resolution expressing support for evidence-based programs that facilitate social and emotional learning during and beyond the COVID-19 pandemic.,2020-09-14T04:00:00+00:00,2020-09-14T04:00:00+00:00,Introduced in Senate
Teachers and School LEADERS Act,2019-02-13T05:00:00+00:00,2019-02-13T05:00:00+00:00,Introduced in Senate
Healthy Soils Healthy Climate Act of 2020,2020-10-23T04:00:00+00:00,2020-10-23T04:00:00+00:00,Introduced in Senate
Burma Political Prisoners Assistance Act,2019-04-15T04:00:00+00:00,2019-09-25T04:00:00+00:00,Received in the Senate and Read twice and referred to the Committee on Foreign Relations.
CAMPUS HATE Crimes Act,2019-01-24T05:00:00+00:00,2019-01-24T05:00:00+00:00,Introduced in House
Department of Defense Ethics and Anti-corruption Act of 2019,2019-05-16T04:00:00+00:00,2019-05-16T04:00:00+00:00,Introduced in Senate
