Growing Climate Solutions Act of 2021,2021-04-22T04:00:00+00:00,2021-04-22T04:00:00+00:00,Introduced in House
Energy Sector Innovation Credit Act of 2021,2021-07-27T04:00:00+00:00,2022-07-28T20:52:42+00:00,"ASSUMING FIRST SPONSORSHIP - Mr. Schweikert asked unanimous consent that he may hereafter be considered as the first sponsor of H.R. 4720, a bill originally introduced by Representative Reed, for the purpose of adding cosponsors and requesting reprintings pursuant to clause 7 of rule XII. Agreed to without objection."
Department of Defense Climate Resiliency and Readiness Act,2021-07-20T04:00:00+00:00,2021-07-20T04:00:00+00:00,Introduced in House
Break Free From Plastic Pollution Act of 2021,2021-03-26T04:00:00+00:00,2022-06-30T04:00:00+00:00,Subcommittee Hearings Held.
CLEAN Future Act,2021-03-02T05:00:00+00:00,2022-06-30T04:00:00+00:00,Subcommittee Hearings Held.
Department of Defense Climate Resiliency and Readiness Act,2021-07-15T04:00:00+00:00,2021-07-15T04:00:00+00:00,Introduced in Senate
Supporting the teaching of climate change in schools.,2021-01-11T05:00:00+00:00,2021-01-11T05:00:00+00:00,Introduced in House
Sustaining America’s Fisheries for the Future Act of 2021,2021-07-26T04:00:00+00:00,2022-09-29T04:00:00+00:00,Committee Consideration and Mark-up Session Held.
Stop Wall Street Looting Act,2021-10-20T04:00:00+00:00,2022-09-08T04:00:00+00:00,"Committee on Banking, Housing, and Urban Affairs. Hearings held."
Keeping All Students Safe Act,2021-05-25T04:00:00+00:00,2021-05-25T04:00:00+00:00,Introduced in House
Stop Wall Street Looting Act,2021-10-20T04:00:00+00:00,2021-10-20T04:00:00+00:00,Introduced in House
Black Maternal Health Momnibus Act of 2021,2021-02-22T05:00:00+00:00,2021-02-22T05:00:00+00:00,Introduced in Senate
FIRE Act,2021-08-13T04:00:00+00:00,2021-08-13T04:00:00+00:00,Introduced in House
Black Maternal Health Momnibus Act of 2021,2021-02-08T05:00:00+00:00,2021-04-23T04:00:00+00:00,"Referred to the Subcommittee on Crime, Terrorism, and Homeland Security."
FOREST Act of 2021,2021-10-08T04:00:00+00:00,2021-11-04T04:00:00+00:00,Sponsor introductory remarks on measure. (CR H6186-6187)
Protecting Moms and Babies Against Climate Change Act,2021-02-08T05:00:00+00:00,2021-02-09T05:00:00+00:00,Referred to the Subcommittee on Health.
Protecting Moms and Babies Against Climate Change Act,2021-02-24T05:00:00+00:00,2021-02-24T05:00:00+00:00,Introduced in Senate
Department of Peacebuilding Act of 2021,2021-02-18T05:00:00+00:00,2021-02-18T05:00:00+00:00,Introduced in House
Judiciary Accountability Act of 2021,2021-07-29T04:00:00+00:00,2021-07-29T04:00:00+00:00,Introduced in Senate
Safe Schools Improvement Act of 2021,2021-07-09T04:00:00+00:00,2021-07-09T04:00:00+00:00,Introduced in House
National Ocean Exploration Act,2021-02-23T05:00:00+00:00,2022-02-15T05:00:00+00:00,"By Senator Cantwell from Committee on Commerce, Science, and Transportation filed written report. Report No. 117-76."
A resolution marking the 4-year anniversary of the devastation of Puerto Rico and the United States Virgin Islands by Hurricane Maria.,2021-09-21T04:00:00+00:00,2021-09-21T04:00:00+00:00,Introduced in Senate
Asuncion Valdivia Heat Illness and Fatality Prevention Act of 2021,2021-03-26T04:00:00+00:00,2022-07-27T04:00:00+00:00,Committee Consideration and Mark-up Session Held.
PUGET SOS Act,2021-02-18T05:00:00+00:00,2021-06-16T04:00:00+00:00,Received in the Senate and Read twice and referred to the Committee on Environment and Public Works.
FLOODS Act,2021-03-03T05:00:00+00:00,2021-10-02T00:09:36+00:00,Held at the desk.
Next Generation Fuels Act of 2021,2021-08-24T04:00:00+00:00,2021-08-25T04:00:00+00:00,Referred to the Subcommittee on Environment and Climate Change.
Future Generations Protection Act,2021-12-07T05:00:00+00:00,2021-12-17T05:00:00+00:00,Referred to the Subcommittee on Energy and Mineral Resources.
Full-Service Community School Expansion Act of 2021,2021-02-23T05:00:00+00:00,2021-02-23T05:00:00+00:00,Introduced in House
Agriculture Resilience Act,2021-04-22T04:00:00+00:00,2021-04-23T04:00:00+00:00,Referred to the Subcommittee on Energy.
Blue Carbon Protection Act,2021-06-15T04:00:00+00:00,2021-06-22T04:00:00+00:00,Committee Hearings Held.
America’s Red Rock Wilderness Act,2021-06-08T04:00:00+00:00,2021-07-06T04:00:00+00:00,"Referred to the Subcommittee on National Parks, Forests, and Public Lands."
Judiciary Accountability Act of 2021,2021-07-29T04:00:00+00:00,2021-07-29T04:00:00+00:00,Introduced in House
Real Emergency Access for Aging and Disability Inclusion for Disasters Act,2021-08-06T04:00:00+00:00,2021-08-09T04:00:00+00:00,Referred to the Subcommittee on Health.
Department of Homeland Security Climate Change Research Act,2021-06-08T04:00:00+00:00,2022-09-14T04:00:00+00:00,"Subcommittee on Cybersecurity, Infrastructure Protection, and Innovation Discharged."
Andy’s Bill,2021-07-27T04:00:00+00:00,2021-07-28T04:00:00+00:00,Referred to the Subcommittee on Water Resources and Environment.
"To establish a Global Climate Change Resilience Strategy, to authorize the admission of climate-displaced persons, and for other purposes.",2021-04-22T04:00:00+00:00,2021-10-19T04:00:00+00:00,Referred to the Subcommittee on Immigration and Citizenship.
Climate Change Health Protection and Promotion Act of 2021,2021-05-17T04:00:00+00:00,2021-05-18T04:00:00+00:00,Referred to the Subcommittee on Health.
Alaska Salmon Research Task Force Act,2021-12-16T05:00:00+00:00,2022-05-11T04:00:00+00:00,"Committee on Commerce, Science, and Transportation. Ordered to be reported with an amendment in the nature of a substitute favorably."
30 × 30 Termination Act,2021-05-18T04:00:00+00:00,2021-05-18T04:00:00+00:00,Introduced in Senate
FUTURE Western Water Infrastructure and Drought Resiliency Act,2021-05-20T04:00:00+00:00,2021-07-05T04:00:00+00:00,"Referred to the Subcommittee on Water, Oceans, and Wildlife."
Tradeable Performance Standard Act,2021-03-11T05:00:00+00:00,2021-03-12T05:00:00+00:00,Referred to the Subcommittee on Environment and Climate Change.
National Wildland Fire Risk Reduction Program Act,2021-10-28T04:00:00+00:00,2021-11-16T05:00:00+00:00,Committee Consideration and Mark-up Session Held.
Extinction Crisis Emergency Act of 2021,2021-06-25T04:00:00+00:00,2021-07-24T04:00:00+00:00,"Referred to the Subcommittee on Water, Oceans, and Wildlife."
BLUE Pacific Act,2021-05-04T04:00:00+00:00,2021-05-04T04:00:00+00:00,Introduced in House
Safe Schools Improvement Act of 2021,2021-07-21T04:00:00+00:00,2021-07-21T04:00:00+00:00,Introduced in Senate
America's Clean Future Fund Act,2021-04-12T04:00:00+00:00,2021-04-13T04:00:00+00:00,Referred to the Subcommittee on Highways and Transit.
MARKET CHOICE Act,2021-05-07T04:00:00+00:00,2022-07-05T04:00:00+00:00,Referred to the Subcommittee on Energy and Mineral Resources.
NEXT in Transportation Act,2021-10-26T04:00:00+00:00,2021-10-26T04:00:00+00:00,Introduced in Senate
Marine Mammal Climate Change Protection Act,2021-06-04T04:00:00+00:00,2021-07-13T04:00:00+00:00,"Referred to the Subcommittee on National Parks, Forests, and Public Lands."
"Build Local, Hire Local Act",2021-05-25T04:00:00+00:00,2021-07-01T04:00:00+00:00,"Referred to the Subcommittee on Commodity Exchanges, Energy, and Credit."
Twenty-First Century Dams Act,2021-07-09T04:00:00+00:00,2021-08-11T04:00:00+00:00,Referred to the Subcommittee on Conservation and Forestry.
Expressing support for the designation of September 2021 as National Campus Sexual Assault Awareness Month.,2021-09-10T04:00:00+00:00,2021-09-10T04:00:00+00:00,Introduced in House
Israel Relations Normalization Act of 2021,2021-03-25T04:00:00+00:00,2021-06-24T04:00:00+00:00,Committee on Foreign Relations. Ordered to be reported with an amendment favorably.
Growing Climate Solutions Act of 2021,2021-04-20T04:00:00+00:00,2021-06-24T20:45:22+00:00,Held at the desk.
Wildfire Emergency Act of 2021,2021-05-25T04:00:00+00:00,2021-07-07T04:00:00+00:00,Referred to the Subcommittee on Conservation and Forestry.
Civilian Climate Corps Act of 2021,2021-03-26T04:00:00+00:00,2021-06-15T04:00:00+00:00,Referred to the Subcommittee on Conservation and Forestry.
United States Innovation and Competition Act of 2021,2021-04-20T04:00:00+00:00,2021-06-08T04:00:00+00:00,Considered by Senate. (consideration: CR S3975-3980)
"Expressing the sense of the House of Representatives that it is the duty of the Department of Defense to reduce the overall environmental impact of all military activities and missions, and for other purposes.",2021-11-03T04:00:00+00:00,2021-11-03T04:00:00+00:00,Introduced in House
Energy Resource Governance Initiative Act of 2021,2021-04-22T04:00:00+00:00,2021-05-19T04:00:00+00:00,Committee Consideration and Mark-up Session Held.
Sustainable International Financial Institutions Act of 2021,2021-10-28T04:00:00+00:00,2021-10-28T04:00:00+00:00,Introduced in House
Ending PUSHOUT Act of 2021,2021-03-26T04:00:00+00:00,2021-03-26T04:00:00+00:00,Introduced in House
Counseling Not Criminalization in Schools Act,2021-06-17T04:00:00+00:00,2021-06-17T04:00:00+00:00,Introduced in House
Livable Communities Act of 2021,2021-08-05T04:00:00+00:00,2022-08-04T04:00:00+00:00,"Committee on Banking, Housing, and Urban Affairs. Hearings held."
Surface Transportation Investment Act of 2021,2021-06-10T04:00:00+00:00,2021-12-17T05:00:00+00:00,"Committee on Commerce, Science, and Transportation. Reported by Senator Cantwell with an amendment in the nature of a substitute. Without written report."
Protecting our Students in Schools Act of 2021,2021-06-11T04:00:00+00:00,2021-06-11T04:00:00+00:00,Introduced in House
Global Investment in American Jobs Act of 2021,2021-04-30T04:00:00+00:00,2021-05-03T04:00:00+00:00,Referred to the Subcommittee on Consumer Protection and Commerce.
Environmental Justice For All Act,2021-03-18T04:00:00+00:00,2022-07-27T04:00:00+00:00,Committee Consideration and Mark-up Session Held.
Driftless Area Landscape Conservation Initiative Act,2021-12-07T05:00:00+00:00,2022-01-04T05:00:00+00:00,Referred to the Subcommittee on Conservation and Forestry.
Expeditionary Diplomacy Act of 2021,2021-03-10T05:00:00+00:00,2021-03-10T05:00:00+00:00,Introduced in Senate
Third Reconstruction: Fully addressing poverty and low wages from the bottom up.,2021-05-25T04:00:00+00:00,2021-05-25T04:00:00+00:00,Introduced in House
Keep America’s Waterfronts Working Act,2021-05-12T04:00:00+00:00,2021-06-22T04:00:00+00:00,Committee Hearings Held.
Turkey Human Rights Promotion Act of 2021,2021-07-20T04:00:00+00:00,2021-07-20T04:00:00+00:00,Introduced in House
Blue Carbon for Our Planet Act,2021-04-22T04:00:00+00:00,2021-06-22T04:00:00+00:00,Committee Hearings Held.
Climate Agricultural Conservation Practices Act,2021-04-22T04:00:00+00:00,2021-04-22T04:00:00+00:00,Introduced in House
Climate Justice Grants Act,2021-04-12T04:00:00+00:00,2021-04-13T04:00:00+00:00,Referred to the Subcommittee on Environment and Climate Change.
Manufacturing Reinvestment Corporation Act,2021-08-27T04:00:00+00:00,2021-09-14T04:00:00+00:00,"Referred to the Subcommittee on Nutrition, Oversight, and Department Operations."
Preventing Our Next Natural Disaster Act,2021-12-02T05:00:00+00:00,2021-12-02T05:00:00+00:00,Introduced in House
Buy Green Act of 2021,2021-05-27T04:00:00+00:00,2022-08-04T04:00:00+00:00,"Committee on Banking, Housing, and Urban Affairs. Hearings held."
Infrastructure Investment and Jobs Act,2021-06-04T04:00:00+00:00,2022-08-04T04:00:00+00:00,"Committee on Banking, Housing, and Urban Affairs. Hearings held."
BUILD GREEN Infrastructure and Jobs Act,2021-03-18T04:00:00+00:00,2022-08-04T04:00:00+00:00,"Committee on Banking, Housing, and Urban Affairs. Hearings held."
Fishery Resource Disasters Improvement Act,2021-09-30T04:00:00+00:00,2021-10-03T04:00:00+00:00,"Referred to the Subcommittee on Water, Oceans, and Wildlife."
U.S. Citizenship Act,2021-02-18T05:00:00+00:00,2021-04-28T04:00:00+00:00,Referred to the Subcommittee on Immigration and Citizenship.
National Coastal Resilience Data and Services Act,2021-05-13T04:00:00+00:00,2022-01-19T05:00:00+00:00,"Subcommittee on Water, Oceans, and Wildlife Discharged."
Climate Emergency Act of 2021,2021-02-04T05:00:00+00:00,2021-02-05T05:00:00+00:00,"Referred to the Subcommittee on Economic Development, Public Buildings, and Emergency Management."
Northern Rockies Ecosystem Protection Act,2021-03-10T05:00:00+00:00,2021-05-12T04:00:00+00:00,"Referred to the Subcommittee on National Parks, Forests, and Public Lands."
Surface Transportation Reauthorization Act of 2021,2021-05-27T04:00:00+00:00,2021-05-27T04:00:00+00:00,Introduced in Senate
Green Transportation Act,2021-05-11T04:00:00+00:00,2021-05-12T04:00:00+00:00,Referred to the Subcommittee on Highways and Transit.
Ocean-Based Climate Solutions Act of 2021,2021-06-08T04:00:00+00:00,2021-07-14T04:00:00+00:00,Committee Consideration and Mark-up Session Held.
Rural Energy for America Program (REAP) Improvement Act of 2021,2021-06-24T04:00:00+00:00,2021-06-24T04:00:00+00:00,Introduced in Senate
Turkey Human Rights Promotion Act of 2021,2021-07-20T04:00:00+00:00,2021-07-20T04:00:00+00:00,Introduced in Senate
Surface Transportation Reauthorization Act of 2021,2021-05-26T04:00:00+00:00,2021-10-06T04:00:00+00:00,By Senator Carper from Committee on Environment and Public Works filed written report. Report No. 117-41.
Rural Energy for America Program (REAP) Improvement Act of 2021,2021-06-24T04:00:00+00:00,2021-07-22T04:00:00+00:00,"Referred to the Subcommittee on Commodity Exchanges, Energy, and Credit."
Housing is Infrastructure Act of 2021,2021-07-16T04:00:00+00:00,2021-07-22T04:00:00+00:00,Sponsor introductory remarks on measure. (CR E800-801)
Trillion Trees Act,2021-04-19T04:00:00+00:00,2021-06-15T04:00:00+00:00,Referred to the Subcommittee on Conservation and Forestry.
National Defense Authorization Act for Fiscal Year 2022,2021-07-02T04:00:00+00:00,2022-03-01T05:00:00+00:00,Returned to the Calendar. Calendar No. 144.
FOREST Act of 2021,2021-10-06T04:00:00+00:00,2021-10-06T04:00:00+00:00,Introduced in Senate
A concurrent resolution setting forth the congressional budget for the United States Government for fiscal year 2022 and setting forth the appropriate budgetary levels for fiscal years 2023 through 2031.,2021-08-09T04:00:00+00:00,2021-08-24T20:11:53+00:00,"Passed/agreed to in House: Pursuant to the provisions of H. Res. 601, S. Con. Res. 14 is considered passed House.(text: CR H4372-4384)"
Agriculture Resilience Act of 2021,2021-04-22T04:00:00+00:00,2021-04-22T04:00:00+00:00,Introduced in Senate
BE HEARD in the Workplace Act,2021-11-17T05:00:00+00:00,2021-11-29T05:00:00+00:00,Referred to the Subcommittee on Oversight and Investigations.
National Defense Authorization Act for Fiscal Year 2022,2021-09-22T04:00:00+00:00,2021-09-22T04:00:00+00:00,Introduced in Senate
Native Plant Species Pilot Program Act of 2021,2021-03-03T05:00:00+00:00,2022-07-21T04:00:00+00:00,Committee on Energy and Natural Resources. Ordered to be reported with an amendment in the nature of a substitute favorably.
Alaska Offshore Parity Act,2021-10-19T04:00:00+00:00,2022-07-21T04:00:00+00:00,Committee on Energy and Natural Resources. Ordered to be reported with amendments favorably.
Hydropower Clean Energy Future Act,2021-03-03T05:00:00+00:00,2021-03-04T05:00:00+00:00,Referred to the Subcommittee on Energy.
Healthy Soils Healthy Climate Act of 2021,2021-04-22T04:00:00+00:00,2021-04-22T04:00:00+00:00,Introduced in Senate
Patsy T. Mink and Louise M. Slaughter Gender Equity in Education Act of 2021,2021-06-23T04:00:00+00:00,2021-06-23T04:00:00+00:00,Introduced in House
AMAZON21 Act,2021-11-03T04:00:00+00:00,2021-11-03T04:00:00+00:00,Introduced in House
Castner Range National Monument Act,2021-04-22T04:00:00+00:00,2021-06-15T04:00:00+00:00,"Referred to the Subcommittee on National Parks, Forests, and Public Lands."
Comprehensive National Mercury Monitoring Act,2021-04-22T04:00:00+00:00,2022-07-13T04:00:00+00:00,Committee on Environment and Public Works. Hearings held.
Clean Cooking Support Act,2021-11-18T05:00:00+00:00,2021-11-18T05:00:00+00:00,Introduced in Senate
Clean Cooking Support Act,2021-12-16T05:00:00+00:00,2021-12-17T05:00:00+00:00,Referred to the Subcommittee on Energy.
EDUCATORS for America Act,2021-12-09T05:00:00+00:00,2021-12-09T05:00:00+00:00,Introduced in House
Climate Change Financial Risk Act of 2021,2021-05-28T04:00:00+00:00,2021-05-31T04:00:00+00:00,Referred to the Subcommittee on Environment and Climate Change.
"To provide for the withdrawal of the United States from the United Nations Framework Convention on Climate Change, and for other purposes.",2021-04-22T04:00:00+00:00,2021-04-22T04:00:00+00:00,Introduced in House
Retirees Sustainable Investment Opportunities Act of 2021,2021-05-28T04:00:00+00:00,2021-05-28T04:00:00+00:00,Introduced in House
Keeping All Students Safe Act,2021-05-26T04:00:00+00:00,2021-05-26T04:00:00+00:00,Introduced in Senate
GREEN Communications Act,2021-04-29T04:00:00+00:00,2021-04-29T04:00:00+00:00,Introduced in Senate
National Defense Authorization Act for Fiscal Year 2022,2021-05-13T04:00:00+00:00,2021-12-27T05:00:00+00:00,Signed by President.
REVIVE the CCC Act,2021-09-07T04:00:00+00:00,2021-09-07T04:00:00+00:00,Introduced in House
Environmental Justice Mapping and Data Collection Act of 2021,2021-01-28T05:00:00+00:00,2021-01-28T05:00:00+00:00,Introduced in Senate
Taiwan Fellowship Act,2021-05-11T04:00:00+00:00,2021-05-28T04:00:00+00:00,"Referred to the Subcommittee on Asia, the Pacific, Central Asia and Nonproliferation."
"Chesapeake Bay Science, Education, and Ecosystem Enhancement Act of 2021",2021-05-25T04:00:00+00:00,2022-02-16T05:00:00+00:00,"Subcommittee on Water, Oceans, and Wildlife Discharged."
Environmental Justice Mapping and Data Collection Act of 2021,2021-01-28T05:00:00+00:00,2021-02-02T05:00:00+00:00,Referred to the Subcommittee on Environment and Climate Change.
Prioritizing Clean Energy and Climate Cooperation with India Act of 2021,2021-09-13T04:00:00+00:00,2021-09-13T04:00:00+00:00,Introduced in Senate
Preventing HEAT Illness and Deaths Act of 2021,2021-07-28T04:00:00+00:00,2022-06-22T04:00:00+00:00,"Committee on Commerce, Science, and Transportation. Ordered to be reported with an amendment in the nature of a substitute favorably."
Keep It in the Ground Act of 2021,2021-04-14T04:00:00+00:00,2021-04-14T04:00:00+00:00,Introduced in Senate
Domestic Manufacturing Protection Act of 2021,2021-04-22T04:00:00+00:00,2021-04-22T04:00:00+00:00,Introduced in Senate
BURMA Act of 2021,2021-10-05T04:00:00+00:00,2021-10-05T04:00:00+00:00,Introduced in Senate
Extending Government Funding and Delivering Emergency Assistance Act,2021-09-21T04:00:00+00:00,2021-09-30T19:45:13+00:00,Motion to reconsider laid on the table Agreed to without objection.
Climate and Health Protection Act,2021-02-03T05:00:00+00:00,2021-02-04T05:00:00+00:00,Referred to the Subcommittee on Health.
Israel Relations Normalization Act of 2021,2021-04-21T04:00:00+00:00,2021-09-30T04:00:00+00:00,Committee Consideration and Mark-up Session Held.
REAADI for Disasters Act,2021-08-05T04:00:00+00:00,2021-08-05T04:00:00+00:00,Introduced in Senate
Water Infrastructure Modernization Act,2021-11-30T05:00:00+00:00,2021-12-01T05:00:00+00:00,Referred to the Subcommittee on Environment and Climate Change.
"A resolution recognizing the duty of the Federal Government to implement an agenda to Transform, Heal, and Renew by Investing in a Vibrant Economy (""THRIVE"").",2021-02-08T05:00:00+00:00,2021-02-08T05:00:00+00:00,Introduced in Senate
Increasing Community Access to Resiliency Grants Act of 2021,2021-05-20T04:00:00+00:00,2022-03-17T04:00:00+00:00,"hearing held by Subcommittee on Water, Oceans, and Wildlife."
EDUCATORS for America Act,2021-12-09T05:00:00+00:00,2021-12-09T05:00:00+00:00,Introduced in Senate
Addressing Climate Financial Risk Act of 2021,2021-03-04T05:00:00+00:00,2021-03-04T05:00:00+00:00,Introduced in Senate
Expressing the need for the Federal Government to establish a national biodiversity strategy for protecting biodiversity for current and future generations.,2021-01-28T05:00:00+00:00,2021-01-28T05:00:00+00:00,Introduced in House
PREP Act of 2021,2021-06-24T04:00:00+00:00,2021-06-24T04:00:00+00:00,Introduced in Senate
Energy Efficient Public Buildings Act of 2021,2021-07-19T04:00:00+00:00,2021-07-20T04:00:00+00:00,Referred to the Subcommittee on Energy.
Electric Vehicles for Underserved Communities Act of 2021,2021-02-23T05:00:00+00:00,2021-02-24T05:00:00+00:00,Referred to the Subcommittee on Energy.
Rebuild Rural America Act of 2021,2021-02-25T05:00:00+00:00,2021-02-25T05:00:00+00:00,Introduced in Senate
Buy Green Act of 2021,2021-05-28T04:00:00+00:00,2021-06-01T04:00:00+00:00,Referred to the Subcommittee on Highways and Transit.
Office of Manufacturing and Industrial Innovation Policy Act of 2021,2021-03-26T04:00:00+00:00,2021-03-30T04:00:00+00:00,Referred to the Subcommittee on Consumer Protection and Commerce.
Climate Justice Act of 2021,2021-04-08T04:00:00+00:00,2021-04-13T04:00:00+00:00,Referred to the Subcommittee on Environment and Climate Change.
Climate Change Resiliency Fund for America Act of 2021,2021-03-18T04:00:00+00:00,2021-03-19T04:00:00+00:00,Referred to the Subcommittee on Environment and Climate Change.
Providing for the expenses of certain committees of the House of Representatives in the One Hundred Seventeenth Congress.,2021-04-14T04:00:00+00:00,2021-04-20T21:34:14+00:00,"Passed/agreed to in House: Pursuant to the provisions of H. Res. 330, H. Res. 316 is considered passed House.(consideration: CR H1979; text: CR H1979)"
UNSHACKLE Act,2021-06-11T04:00:00+00:00,2021-06-14T04:00:00+00:00,Referred to the Subcommittee on Water Resources and Environment.
"Fair, Affordable, Innovative, and Resilient Transition and Competition Act",2021-07-19T04:00:00+00:00,2021-07-19T04:00:00+00:00,Introduced in Senate
Smaller Class Sizes for Students and Educators Act of 2021,2021-11-23T05:00:00+00:00,2021-11-23T05:00:00+00:00,Introduced in House
"Expressing support for the need for a replacement fleet that meets the climate goals of the United States, protects critical supply chains, and promotes a cleaner, more stable future for a burgeoning 21st century domestic vehicle industry.",2021-03-09T05:00:00+00:00,2021-03-09T05:00:00+00:00,Introduced in House
Blue Carbon for Our Planet Act,2021-11-18T05:00:00+00:00,2021-11-18T05:00:00+00:00,Introduced in Senate
SHELTER Act,2021-06-16T04:00:00+00:00,2021-06-16T04:00:00+00:00,Introduced in House
Fishery Resource Disasters Improvement Act,2021-09-30T04:00:00+00:00,2021-11-17T05:00:00+00:00,"Subcommittee on Water, Oceans, and Wildlife Discharged."
Water Infrastructure Modernization Act of 2021,2021-11-30T05:00:00+00:00,2021-11-30T05:00:00+00:00,Introduced in Senate
Make Energy Affordable Act,2021-12-16T05:00:00+00:00,2021-12-17T05:00:00+00:00,Referred to the Subcommittee on Energy.
SHELTER Act,2021-05-25T04:00:00+00:00,2021-05-25T04:00:00+00:00,Introduced in Senate
BUILD GREEN Infrastructure and Jobs Act,2021-03-18T04:00:00+00:00,2021-03-19T04:00:00+00:00,Referred to the Subcommittee on Highways and Transit.
Mental Health Stigma in the Military Act of 2021,2021-08-20T04:00:00+00:00,2021-08-20T04:00:00+00:00,Introduced in House
RENEW Conservation Corps Act,2021-05-13T04:00:00+00:00,2021-05-14T04:00:00+00:00,Referred to the Subcommittee on Water Resources and Environment.
National Climate Bank Act,2021-02-08T05:00:00+00:00,2021-04-27T04:00:00+00:00,"Committee on Environment and Public Works Senate Subcommittee on Clean Air, Climate, and Nuclear Safety. Hearings held. With printed Hearing: S.Hrg. 117-21."
Southern Nevada Economic Development and Conservation Act,2021-03-03T05:00:00+00:00,2021-04-21T04:00:00+00:00,"Referred to the Subcommittee on National Parks, Forests, and Public Lands."
National Institutes of Clean Energy Act of 2021,2021-05-27T04:00:00+00:00,2021-05-27T04:00:00+00:00,Introduced in Senate
Teachers and Parents at the Table Act,2021-10-21T04:00:00+00:00,2021-10-21T04:00:00+00:00,Introduced in House
Responsible Climate Action and American Competitiveness Act,2021-01-21T05:00:00+00:00,2021-01-22T05:00:00+00:00,Referred to the Subcommittee on Environment and Climate Change.
Bank Merger Review Modernization Act of 2021,2021-09-29T04:00:00+00:00,2021-09-29T04:00:00+00:00,Introduced in House
Southern Nevada Economic Development and Conservation Act,2021-03-03T05:00:00+00:00,2022-03-31T04:00:00+00:00,"Committee on Banking, Housing, and Urban Affairs. Hearings held."
Air Source Heat Pump Act of 2021,2021-03-23T04:00:00+00:00,2021-03-23T04:00:00+00:00,Introduced in Senate
"A concurrent resolution recognizing that the climate crisis is disproportionately affecting the health, economic opportunity, and fundamental rights of children, expressing the sense of Congress that renewed leadership by the United States is needed to address the climate crisis, and recognizing the need of the United States to develop a national, comprehensive, and science-based climate recovery plan to phase out fossil fuel emissions, protect and enhance natural sequestration, and put the United States on a path toward stabilizing the climate system.",2021-04-22T04:00:00+00:00,2021-04-22T04:00:00+00:00,Introduced in Senate
Fossil Free Finance Act,2021-11-04T04:00:00+00:00,2021-11-04T04:00:00+00:00,Introduced in Senate
Comprehensive National Mercury Monitoring Act,2021-04-22T04:00:00+00:00,2021-04-23T04:00:00+00:00,Referred to the Subcommittee on Water Resources and Environment.
GREEN Streets Act,2021-02-24T05:00:00+00:00,2021-02-24T05:00:00+00:00,Introduced in Senate
